STORE,Address,Latitude,Longitude
Crown Industries Limited,Enterprise Road P.O Box 40119,-1.313261,36.852721
New Mathokinju Hardware,Kasarani Mwiki Rd,-1.218414,36.901907
Crown Paint Manufacturers Nairobi,,-1.307442,36.856216
Crown Paint Distributor Samreda,Likoni Road,-1.307522,36.8561021
Taheri Stores,Limuru Road,-1.259507,36.82699
Crown Paint Distributor Westlands Woodvale,Woodvale,-1.263137,36.803473
Crown Paint Distributor Riflobuild,Riflobuild,-1.2428,36.869287
Crown Paint Distributor Joska,Joska,-1.281094,36.822109
Crown Paint DistributorWoodcharm,Woodcharm,-1.278244,36.819558
Crown Paint Distributor Dobie,Dobie,1.298315,36.836449
Crown Paint Distributor Sabmiz,Sabmiz,-1.303474,36.838165
Crown Paint Distributor Rehoboth-Ventures,Rehoboth-Ventures,-1.284644,36.826628
Crown Paint Distributor Aliwoth,Aliwoth,-1.285482,36.826355
Crown Paint Distributor Kagi Electronics,,-1.285117,36.826488
Crown Paint Distributor Maslows,Maslows,-1.327016,36.852703
Crown Paint Distributor Renda,Renda,-1.368009,36.940559
Crown Paint Distributor Miangeni,Miangeni,-1.394719,36.939386
Crown Paint Distributor Plumbline-Hardware,Plumbline-Hardware,-1.263105,36.804861
Crown Paint Distributor Fairview,Fairview,-1.291863,36.81021
Crown Paint Distributor BuildVenture,BuildVenture,-1.303744,36.888541
Crown Paint Distributor-Anims Ceramics,Anims-Ceramics Donholm,-1.299723,36.889707
